{
  "meta": {
    "id": "c3d4e5f6-a7b8-4901-bdef-012345678901",
    "version": "0.8.3",
    "profile": "partner:com.deepadata.companion.v1",
    "created_at": "2026-04-13T21:15:00.000Z",
    "owner_user_id": "vp-05MZ7JNZS0AWMB2TQ0EQ",
    "consent_basis": "consent",
    "visibility": "private",
    "pii_tier": "moderate"
  },
  "core": {
    "anchor": "job interview tomorrow",
    "spark": "anxiety about being judged",
    "wound": "fear of not being enough",
    "fuel": "talking through fears out loud",
    "bridge": "panic to cautious optimism",
    "echo": "maybe I am prepared after all",
    "narrative": "User shared anxiety about tomorrow's job interview for a position they really want. Talked through worst-case scenarios and realized most fears were unlikely. Discussed their qualifications and past successes. Conversation shifted from panic to cautious optimism. User said talking it through helped them realize they've done harder things before."
  },
  "constellation": {
    "emotion_primary": "anxiety",
    "emotion_subtone": [
      "hope",
      "vulnerability",
      "determination"
    ],
    "narrative_arc": "overcoming",
    "interpersonal_affect": "openness",
    "relational_dynamics": "companionship",
    "identity_thread": "capable professional who doubts themselves",
    "arc_type": "threshold",
    "temporal_rhythm": "rising"
  },
  "milky_way": {
    "event_type": "pre-interview support conversation",
    "visibility_context": "private",
    "tone_shift": "panic to optimism"
  },
  "gravity": {
    "emotional_weight": 0.72,
    "valence": "mixed",
    "tether_type": "event",
    "recurrence_pattern": "cyclical",
    "strength_score": 0.68
  },
  "governance": {
    "jurisdiction": null,
    "retention_policy": {
      "basis": "user_defined",
      "ttl_days": null,
      "on_expiry": "soft_delete"
    },
    "subject_rights": {
      "portable": true,
      "erasable": true,
      "explainable": false
    }
  },
  "telemetry": {
    "entry_confidence": 0.88,
    "extraction_model": "claude-sonnet-4-20250514"
  }
}
