{
  "meta": {
    "id": "d4e5f6a7-b8c9-4012-bef0-123456789012",
    "version": "0.8.3",
    "profile": "partner:com.deepadata.wiki.v1",
    "created_at": "2026-04-13T16:00:00.000Z",
    "owner_user_id": "vp-02HZ4GKWP7XTJY9QN7BN",
    "consent_basis": "consent",
    "visibility": "private",
    "pii_tier": "moderate"
  },
  "core": {
    "anchor": "physie competitions",
    "spark": "competition photos arrived",
    "wound": "arthritis diagnosis",
    "fuel": "supportive women's community",
    "bridge": "performing despite limits",
    "echo": "feeling twenty again",
    "narrative": "Weekend physie competition photos arrived, capturing the joy of performing despite a psoriatic arthritis diagnosis years ago. A supportive community of women and weekly classes keep both joints mobile and spirits high. Dancing in front of crowds revives the professional dancer within, defying physical limitations. What began as gentle encouragement has become essential self-care."
  },
  "constellation": {
    "emotion_primary": "joy",
    "emotion_subtone": [
      "pride",
      "gratitude",
      "vitality"
    ],
    "narrative_arc": "overcoming",
    "identity_thread": "dancer despite limits",
    "arc_type": "transformation",
    "temporal_context": "midlife",
    "memory_type": "milestone"
  },
  "milky_way": {
    "event_type": "physie competition",
    "location_context": "competition venue",
    "associated_people": [
      "physie classmates"
    ],
    "visibility_context": "shared_publicly",
    "tone_shift": "struggle to celebration"
  },
  "gravity": {
    "emotional_weight": 0.8,
    "valence": "positive",
    "tether_type": "identity",
    "recurrence_pattern": "cyclical",
    "strength_score": 0.9
  },
  "governance": {
    "jurisdiction": null,
    "retention_policy": {
      "basis": "user_defined",
      "ttl_days": null,
      "on_expiry": "soft_delete"
    },
    "subject_rights": {
      "portable": true,
      "erasable": true,
      "explainable": false
    }
  },
  "telemetry": {
    "entry_confidence": 0.94,
    "extraction_model": "claude-sonnet-4-20250514"
  }
}
